{
  "mapName": "Donut Citadel",
  "width": 8,
  "height": 8,
  "validTiles": [
    [0, 0], [1, 0], [2, 0], [3, 0], [4, 0], [5, 0], [6, 0], [7, 0],
    [0, 1], [1, 1], [2, 1], [3, 1], [4, 1], [5, 1], [6, 1], [7, 1],
    [0, 2], [1, 2], [2, 2], [3, 2], [4, 2], [5, 2], [6, 2], [7, 2],
    [0, 3], [1, 3], [2, 3],                         [5, 3], [6, 3], [7, 3],
    [0, 4], [1, 4], [2, 4],                         [5, 4], [6, 4], [7, 4],
    [0, 5], [1, 5], [2, 5], [3, 5], [4, 5], [5, 5], [6, 5], [7, 5],
    [0, 6], [1, 6], [2, 6], [3, 6], [4, 6], [5, 6], [6, 6], [7, 6],
    [0, 7], [1, 7], [2, 7], [3, 7], [4, 7], [5, 7], [6, 7], [7, 7]
  ],
  "whiteThrone": [3, 0],
  "blackThrone": [4, 7],
  "startingPieces": [
    { "id": 1, "owner": "WHITE", "type": "ROCK", "pos": [1, 1] },
    { "id": 2, "owner": "WHITE", "type": "SCISSORS", "pos": [2, 1] },
    { "id": 3, "owner": "WHITE", "type": "PAPER", "pos": [3, 1] },
    { "id": 4, "owner": "WHITE", "type": "ROCK", "pos": [4, 1] },
    { "id": 5, "owner": "WHITE", "type": "SCISSORS", "pos": [5, 1] },
    { "id": 6, "owner": "WHITE", "type": "PAPER", "pos": [6, 1] },
    { "id": 11, "owner": "BLACK", "type": "ROCK", "pos": [1, 6] },
    { "id": 12, "owner": "BLACK", "type": "SCISSORS", "pos": [2, 6] },
    { "id": 13, "owner": "BLACK", "type": "PAPER", "pos": [3, 6] },
    { "id": 14, "owner": "BLACK", "type": "ROCK", "pos": [4, 6] },
    { "id": 15, "owner": "BLACK", "type": "SCISSORS", "pos": [5, 6] },
    { "id": 16, "owner": "BLACK", "type": "PAPER", "pos": [6, 6] }
  ]
}
